{"schema_version":1,"run_id":"gate-e8c307e670d73a059eeb62145a3cfd5024ca7c67dc2fc2c2689ecc0bb92f88c1","snapshot_id":"snap-4b4087e1407ceddcb1e1cfcd978eedbc8906cf88083ba3b4672c7c225ddd8374-p0-normalize-1-a38575cd51ec2730442a0f3b8506c99fc49eec68d4b28ecdc9dda9434709ace6","findings":[{"id":"gate-e8c307e670d73a059eeb62145a3cfd5024ca7c67dc2fc2c2689ecc0bb92f88c1#git.clean","rule_id":"git.clean","state":"N/A","effective_severity":"PASS","summary":"`release.require_clean_git` is false, so a clean workspace is not required.","evidence_refs":["policy:release.require_clean_git"],"remediation":null},{"id":"gate-e8c307e670d73a059eeb62145a3cfd5024ca7c67dc2fc2c2689ecc0bb92f88c1#release.commit_matches_expected","rule_id":"release.commit_matches_expected","state":"N/A","effective_severity":"PASS","summary":"No `release.expected_commit` is declared for this release.","evidence_refs":["policy:release.expected_commit"],"remediation":null},{"id":"gate-e8c307e670d73a059eeb62145a3cfd5024ca7c67dc2fc2c2689ecc0bb92f88c1#release.version_matches_policy","rule_id":"release.version_matches_policy","state":"PASS","effective_severity":"PASS","summary":"Workspace tag `v1.2.3` matches the version pattern and its version `1.2.3` is the declared release version.","evidence_refs":["policy:version.source","policy:version.pattern","git:exact-tag=v1.2.3","policy:release.expected_version"],"remediation":null},{"id":"gate-e8c307e670d73a059eeb62145a3cfd5024ca7c67dc2fc2c2689ecc0bb92f88c1#artifacts.required","rule_id":"artifacts.required","state":"PASS","effective_severity":"PASS","summary":"Every required artifact kind is present in the snapshot (elf, map).","evidence_refs":["policy:artifacts.required=elf,map","artifact:elf:4b4087e1407ceddcb1e1cfcd978eedbc8906cf88083ba3b4672c7c225ddd8374","artifact:map:a38575cd51ec2730442a0f3b8506c99fc49eec68d4b28ecdc9dda9434709ace6"],"remediation":null},{"id":"gate-e8c307e670d73a059eeb62145a3cfd5024ca7c67dc2fc2c2689ecc0bb92f88c1#artifacts.hashes","rule_id":"artifacts.hashes","state":"PASS","effective_severity":"PASS","summary":"All 2 snapshot artifact(s) carry a SHA-256 digest.","evidence_refs":["artifact:elf:4b4087e1407ceddcb1e1cfcd978eedbc8906cf88083ba3b4672c7c225ddd8374","artifact:map:a38575cd51ec2730442a0f3b8506c99fc49eec68d4b28ecdc9dda9434709ace6","policy:artifacts.hashes"],"remediation":null},{"id":"gate-e8c307e670d73a059eeb62145a3cfd5024ca7c67dc2fc2c2689ecc0bb92f88c1#memory.flash_budget","rule_id":"memory.flash_budget","state":"PASS","effective_severity":"PASS","summary":"Nonvolatile footprint 376 B is within the 512 B budget (136 B headroom).","evidence_refs":["policy:memory.flash_budget=512","evidence:ev-memory-nonvolatile_image_footprint_bytes"],"remediation":null},{"id":"gate-e8c307e670d73a059eeb62145a3cfd5024ca7c67dc2fc2c2689ecc0bb92f88c1#memory.ram_budget","rule_id":"memory.ram_budget","state":"PASS","effective_severity":"PASS","summary":"Runtime RAM footprint 76 B is within the 256 B budget (180 B headroom).","evidence_refs":["policy:memory.ram_budget=256","evidence:ev-memory-runtime_ram_footprint_bytes"],"remediation":null},{"id":"gate-e8c307e670d73a059eeb62145a3cfd5024ca7c67dc2fc2c2689ecc0bb92f88c1#diff.growth","rule_id":"diff.growth","state":"N/A","effective_severity":"PASS","summary":"No `[diff]` growth threshold is configured.","evidence_refs":["policy:diff.flash_growth_review_bytes","policy:diff.ram_growth_review_bytes"],"remediation":null},{"id":"gate-e8c307e670d73a059eeb62145a3cfd5024ca7c67dc2fc2c2689ecc0bb92f88c1#release.notes","rule_id":"release.notes","state":"PASS","effective_severity":"PASS","summary":"Release Notes `RELEASE_NOTES.md` is present.","evidence_refs":["policy:release.require_release_notes","file:RELEASE_NOTES.md","file:RELEASE_NOTES.md#sha256=1169e4af5e3daec77ab9b6967e24436c704286e2638468f9efc2ea8ca83a8414"],"remediation":null},{"id":"gate-e8c307e670d73a059eeb62145a3cfd5024ca7c67dc2fc2c2689ecc0bb92f88c1#evidence.unknown_review","rule_id":"evidence.unknown_review","state":"N/A","effective_severity":"PASS","summary":"`gate.unknown_evidence_review_count` is not configured.","evidence_refs":["policy:gate.unknown_evidence_review_count"],"remediation":null}],"extensions":{"policy_sha256":"f65f9c921158ee615c5efcccdacd30106b4897dab1257a83b70311ae66609bab","project_config_schema_version":1,"baseline_snapshot_id":"snap-3f615b6247179d930f59b76dcdbaea1a5eca8c835ab6d410feb20a062f33f21f-p0-normalize-1-832690060a8d25f8acacd85a62ce76bc83dfb6768e435bcc04c51f9664ed363e","overall_effective_severity":"PASS"}}
